{
  "schema": "oobsum-summary/1",
  "fn": "Om_HandleCfg",
  "key": "F@lv8_01_tlv_relative_check.c:Om_HandleCfg",
  "loc": "lv8_01_tlv_relative_check.c:54",
  "params": [{"name": "p", "type": "UINT8*"}, {"name": "n", "type": "UINT32"}, {"name": "o", "type": "UINT8*"}],
  "status": "analyzed",
  "reqs": [
    {
      "id": "R1",
      "kind": "R",
      "have": "ext(p0)",
      "obj": "*p0",
      "end": ["2", "p1 + 2"],
      "start": "2",
      "bound": "check",
      "guard": ["p1 >= 2"],
      "access": {
        "fn": "Tlv_ParseAll",
        "key": "F@lv8_01_tlv_relative_check.c:Tlv_ParseAll",
        "at": "lv8_01_tlv_relative_check.c:34",
        "end": "p1 + 2"
      },
      "path": [
        "Om_HandleCfg@lv8_01_tlv_relative_check.c:54",
        "Msg_ParseBody@lv8_01_tlv_relative_check.c:52",
        "Tlv_ParseAll@lv8_01_tlv_relative_check.c:34"
      ],
      "depth": 2,
      "eff_depth": 0,
      "blind": false,
      "doc": {
        "text": "n >= 2 ⇒ 读 ulLen 字节 @ *p，末端 [2, n + 2]；需 n + 2 <= ext(p)",
        "obj": "*p",
        "bytes": "ulLen",
        "code": "memcpy_s(pucOut, 256, pucBuf + ulOff + 2, ulLen)"
      }
    },
    {
      "id": "R2",
      "kind": "W",
      "have": "ext(p2)",
      "obj": "*p2",
      "end": ["256", "256"],
      "start": "0",
      "bound": "exact",
      "guard": ["p1 >= 2"],
      "access": {
        "fn": "Tlv_ParseAll",
        "key": "F@lv8_01_tlv_relative_check.c:Tlv_ParseAll",
        "at": "lv8_01_tlv_relative_check.c:34",
        "end": "256"
      },
      "path": [
        "Om_HandleCfg@lv8_01_tlv_relative_check.c:54",
        "Msg_ParseBody@lv8_01_tlv_relative_check.c:52",
        "Tlv_ParseAll@lv8_01_tlv_relative_check.c:34"
      ],
      "depth": 2,
      "eff_depth": 0,
      "blind": false,
      "doc": {
        "text": "n >= 2 ⇒ 写 256 字节 @ *o，末端 256；需 256 <= ext(o)",
        "obj": "*o",
        "bytes": "256",
        "code": "memcpy_s(pucOut, 256, pucBuf + ulOff + 2, ulLen)"
      }
    }
  ],
  "effs": [],
  "calls": [
    {
      "site": "lv8_01_tlv_relative_check.c:54",
      "callee": "Msg_ParseBody",
      "args": [
        {"obj": "*p0", "have": "ext(p0)", "alias": "p0", "doc": "p"},
        "p1",
        {"obj": "*p2", "have": "ext(p2)", "alias": "p2", "doc": "o"}
      ],
      "results": [{"req": "R1", "outcome": "up", "as": "R1"}, {"req": "R2", "outcome": "up", "as": "R2"}]
    }
  ],
  "reps": [],
  "opens": []
}
