{
  "schema": "oobsum-summary/1",
  "fn": "Tlv_ParseAll_OK",
  "key": "F@lv8_01_tlv_relative_check.c:Tlv_ParseAll_OK",
  "loc": "lv8_01_tlv_relative_check.c:39",
  "params": [
    {"name": "pucBuf", "type": "UINT8*"},
    {"name": "ulTotal", "type": "UINT32"},
    {"name": "pucOut", "type": "UINT8*"}
  ],
  "status": "analyzed",
  "reqs": [
    {
      "id": "R1",
      "kind": "R",
      "have": "ext(p0)",
      "obj": "*p0",
      "end": ["2", "p1"],
      "start": "2",
      "bound": "check",
      "guard": ["p1 >= 2"],
      "access": {
        "fn": "Tlv_ParseAll_OK",
        "key": "F@lv8_01_tlv_relative_check.c:Tlv_ParseAll_OK",
        "at": "lv8_01_tlv_relative_check.c:47",
        "end": "p1"
      },
      "path": ["Tlv_ParseAll_OK@lv8_01_tlv_relative_check.c:47"],
      "depth": 0,
      "eff_depth": 0,
      "blind": false,
      "absorbed": [{"kind": "R", "end": ["2", "p1"], "at": "lv8_01_tlv_relative_check.c:43"}],
      "doc": {
        "text": "ulTotal >= 2 ⇒ 读 ulLen 字节 @ *pucBuf，末端 [2, ulTotal]；需 ulTotal <= ext(pucBuf)",
        "obj": "*pucBuf",
        "bytes": "ulLen",
        "code": "memcpy_s(pucOut, 256, pucBuf + ulOff + 2, ulLen)",
        "note": "末端 ulOff + 2 + ulLen；本轮校验给出 ulOff + ulLen <= ulTotal − 2"
      }
    },
    {
      "id": "R2",
      "kind": "W",
      "have": "ext(p2)",
      "obj": "*p2",
      "end": ["256", "256"],
      "start": "0",
      "bound": "exact",
      "guard": ["p1 >= 2"],
      "access": {
        "fn": "Tlv_ParseAll_OK",
        "key": "F@lv8_01_tlv_relative_check.c:Tlv_ParseAll_OK",
        "at": "lv8_01_tlv_relative_check.c:47",
        "end": "256"
      },
      "path": ["Tlv_ParseAll_OK@lv8_01_tlv_relative_check.c:47"],
      "depth": 0,
      "eff_depth": 0,
      "blind": false,
      "doc": {
        "text": "ulTotal >= 2 ⇒ 写 256 字节 @ *pucOut，末端 256；需 256 <= ext(pucOut)",
        "obj": "*pucOut",
        "bytes": "256",
        "code": "memcpy_s(pucOut, 256, pucBuf + ulOff + 2, ulLen)",
        "note": "memcpy_s 的目的：destMax 256"
      }
    }
  ],
  "effs": [],
  "calls": [
    {
      "site": "lv8_01_tlv_relative_check.c:47",
      "callee": "memcpy_s",
      "model": "access",
      "args": [
        {"obj": "*p2", "have": "ext(p2)", "doc": "pucOut"},
        "256",
        {"obj": "*p0", "have": "ext(p0) - ulOff - 2", "doc": "pucBuf + ulOff + 2"},
        "ulLen"
      ],
      "results": [{"gen": ["R1", "R2"]}],
      "doc": "访问类模型 memcpy_s → R1（源）、R2（目的）"
    }
  ],
  "reps": [],
  "opens": []
}
