{
  "schema": "oobsum-summary/1",
  "fn": "Ue_ResetMap",
  "key": "F@lv2_05_bitmap_cast_words.c:Ue_ResetMap",
  "loc": "lv2_05_bitmap_cast_words.c:46",
  "params": [{"name": "pucMap", "type": "UINT8*"}, {"name": "ulBits", "type": "UINT32"}],
  "status": "analyzed",
  "reqs": [
    {
      "id": "R1",
      "kind": "W",
      "have": "ext(p0)",
      "obj": "*p0",
      "end": ["4", "4*div(p1, 32) + 4"],
      "start": "0",
      "bound": "loop",
      "guard": [],
      "access": {
        "fn": "Map_ClearWords",
        "key": "F@lv2_05_bitmap_cast_words.c:Map_ClearWords",
        "at": "lv2_05_bitmap_cast_words.c:33",
        "end": "4*div(p1, 32) + 4"
      },
      "path": ["Ue_ResetMap@lv2_05_bitmap_cast_words.c:46", "Map_ClearWords@lv2_05_bitmap_cast_words.c:33"],
      "depth": 1,
      "eff_depth": 0,
      "blind": false,
      "doc": {
        "text": "写 4 字节 @ *pucMap，末端 [4, 4*div(ulBits, 32) + 4]；需 4*div(ulBits, 32) + 4 <= ext(pucMap)",
        "obj": "*pucMap",
        "bytes": "4",
        "code": "pulMap[i] = 0"
      }
    }
  ],
  "effs": [],
  "calls": [
    {
      "site": "lv2_05_bitmap_cast_words.c:46",
      "callee": "Map_ClearWords",
      "args": [{"obj": "*p0", "have": "ext(p0)", "alias": "p0", "doc": "pucMap"}, "p1"],
      "results": [{"req": "R1", "outcome": "up", "as": "R1"}]
    }
  ],
  "reps": [],
  "opens": []
}
