{
  "schema": "oobsum-summary/1",
  "fn": "Cell_OnDelReq_TP",
  "key": "F:Cell_OnDelReq_TP",
  "loc": "lv4_06_validator_func.c:60",
  "params": [{"name": "ulCellId", "type": "UINT32"}],
  "status": "analyzed",
  "reqs": [],
  "effs": [{"kind": "ret_int", "range": ["0", "1"], "bound": "const", "doc": {"text": "ret ∈ [0, 1]"}}],
  "calls": [
    {
      "site": "lv4_06_validator_func.c:62",
      "callee": "Cell_CheckPara",
      "args": ["p0"],
      "results": [
        {"eff": 0, "apply": {"kind": "ret_cond", "when": "ret == 0", "then": ["p0 <= 16"]}},
        {"eff": 1, "apply": {"kind": "ret_cond", "when": "ret == 1", "then": ["p0 >= 17"]}}
      ],
      "doc": "分支 != VOS_OK 就 return；落到下面的一侧 ret == VOS_OK(0) → 守卫 ulCellId <= 16"
    },
    {
      "site": "lv4_06_validator_func.c:65",
      "callee": "Cell_Delete",
      "args": ["p0"],
      "guards": [{"cond": "p0 <= 16", "bound": "check", "doc": "Cell_CheckPara 的条件效应 ret == 0 ⇒ ulCellId <= 16"}],
      "results": [{"req": "R1", "outcome": "L2", "report": "RPT1"}]
    }
  ],
  "reps": [
    {
      "id": "RPT1",
      "level": "L2",
      "reported": true,
      "site": "lv4_06_validator_func.c:65",
      "access": {
        "fn": "Ctx_Clear",
        "key": "F@lv4_06_validator_func.c:Ctx_Clear",
        "at": "lv4_06_validator_func.c:54",
        "end": "32*p0 + 32"
      },
      "kind": "W",
      "obj": "g:g_astCellCtx",
      "have": "512",
      "end": ["32", "544"],
      "bound": "check",
      "depth": 3,
      "eff_depth": 0,
      "chain": [
        "Cell_OnDelReq_TP@lv4_06_validator_func.c:65",
        "Cell_Delete@lv4_06_validator_func.c:58",
        "Cell_FreeCtx@lv4_06_validator_func.c:57",
        "Ctx_Clear@lv4_06_validator_func.c:54"
      ],
      "fp": "4d216e4ae4174b92",
      "doc": {
        "msg": "Possible out-of-bound write through a 3-level call chain: up to byte 544 of 'g_astCellCtx' (512 bytes) may be accessed; the bound comes from a check"
      }
    }
  ],
  "opens": []
}
