{
  "schema": "oobsum-summary/1",
  "fn": "Port_SetMode",
  "key": "F@lv3_03_callee_guard_wrong.c:Port_SetMode",
  "loc": "lv3_03_callee_guard_wrong.c:35",
  "params": [
    {"name": "astPort", "type": "PORT_S*"},
    {"name": "ulPortId", "type": "UINT32"},
    {"name": "ulMode", "type": "UINT32"}
  ],
  "status": "analyzed",
  "reqs": [
    {
      "id": "R1",
      "kind": "W",
      "have": "ext(p0)",
      "obj": "*p0",
      "end": ["24*p1 + 4", "24*p1 + 4"],
      "start": "24*p1",
      "bound": "exact",
      "guard": ["p1 <= 31"],
      "access": {
        "fn": "Port_SetMode",
        "key": "F@lv3_03_callee_guard_wrong.c:Port_SetMode",
        "at": "lv3_03_callee_guard_wrong.c:40",
        "end": "24*p1 + 4"
      },
      "path": ["Port_SetMode@lv3_03_callee_guard_wrong.c:40"],
      "depth": 0,
      "eff_depth": 0,
      "blind": false,
      "doc": {
        "text": "ulPortId <= 31 ⇒ 写 4 字节 @ *astPort，末端 24*ulPortId + 4；需 24*ulPortId + 4 <= ext(astPort)",
        "obj": "*astPort",
        "bytes": "4",
        "code": "astPort[ulPortId].ulMode = ulMode",
        "note": "if (ulPortId >= 32) return → 守卫；PORT_S 24 字节，ulMode 在偏移 0"
      }
    }
  ],
  "effs": [],
  "calls": [],
  "reps": [],
  "opens": []
}
