{
  "schema": "oobsum-summary/1",
  "fn": "Board_InitDefault_TN",
  "key": "F:Board_InitDefault_TN",
  "loc": "lv3_03_callee_guard_wrong.c:47",
  "params": [],
  "status": "analyzed",
  "reqs": [],
  "effs": [],
  "calls": [
    {
      "site": "lv3_03_callee_guard_wrong.c:47",
      "callee": "Board_CfgPort",
      "args": [{"ptr": "g_astBoardPort", "have": "384"}, "3", "0"],
      "results": [{"req": "R1", "outcome": "safe"}]
    }
  ],
  "reps": [],
  "opens": []
}
