{
  "schema": "oobsum-summary/1",
  "fn": "Chip_ReadStatus",
  "key": "F@lv9_04_external_driver.c:Chip_ReadStatus",
  "loc": "lv9_04_external_driver.c:25",
  "params": [{"name": "pucBuf", "type": "UINT8*"}, {"name": "ulLen", "type": "UINT32"}],
  "status": "analyzed",
  "reqs": [],
  "effs": [
    {
      "kind": "ret_int",
      "range": ["0", "4294967295"],
      "bound": "type",
      "doc": {"text": "ret ∈ [0, 4294967295]"}
    }
  ],
  "calls": [
    {
      "site": "lv9_04_external_driver.c:25",
      "callee": "Drv_ReadReg",
      "model": "unknown",
      "args": ["0x40000000", {"obj": "*p0", "have": "ext(p0)", "doc": "pucBuf"}, "p1"],
      "results": [{"open": "unknown_callee"}],
      "doc": "无函数体、无模型：返回值未知；经指针实参可达的格失效；记账 unknown_callee"
    }
  ],
  "reps": [],
  "opens": [
    {
      "reason": "unknown_callee",
      "at": "lv9_04_external_driver.c:25",
      "doc": "Drv_ReadReg 只有声明（BSP 二进制库）；pucBuf / ulLen 流进了它。补模型后生成 R1：ulLen <= ext(pucBuf)"
    }
  ]
}
