{
  "schema": "oobsum-summary/1",
  "fn": "Tlv_WriteVal_OK",
  "key": "F@lv2_03_tlv_destmax_no_off.c:Tlv_WriteVal_OK",
  "loc": "lv2_03_tlv_destmax_no_off.c:34",
  "params": [
    {"name": "pucPkt", "type": "UINT8*"},
    {"name": "ulOff", "type": "UINT32"},
    {"name": "pucVal", "type": "UINT8*"},
    {"name": "ulValLen", "type": "UINT32"}
  ],
  "status": "analyzed",
  "reqs": [
    {
      "id": "R1",
      "kind": "W",
      "have": "ext(p0)",
      "obj": "*p0",
      "end": ["128", "128"],
      "start": "p1",
      "bound": "exact",
      "guard": ["p1 <= 128"],
      "access": {
        "fn": "Tlv_WriteVal_OK",
        "key": "F@lv2_03_tlv_destmax_no_off.c:Tlv_WriteVal_OK",
        "at": "lv2_03_tlv_destmax_no_off.c:36",
        "end": "128"
      },
      "path": ["Tlv_WriteVal_OK@lv2_03_tlv_destmax_no_off.c:36"],
      "depth": 0,
      "eff_depth": 0,
      "blind": false,
      "doc": {
        "text": "ulOff <= 128 ⇒ 写 128 - ulOff 字节 @ *pucPkt，末端 128；需 128 <= ext(pucPkt)",
        "obj": "*pucPkt",
        "bytes": "128 - p1",
        "code": "memcpy_s(pucPkt + ulOff, PKT_MAX_LEN - ulOff, pucVal, ulValLen)",
        "note": "destMax = 128 − ulOff 可能回绕；回绕后 > 0x7fffffff，securec 不写 → 守卫 ulOff <= 128；守卫下末端 ulOff + (128 − ulOff) = 128"
      }
    },
    {
      "id": "R2",
      "kind": "R",
      "have": "ext(p2)",
      "obj": "*p2",
      "end": ["p3", "p3"],
      "start": "0",
      "bound": "exact",
      "guard": ["p1 + p3 <= 128"],
      "access": {
        "fn": "Tlv_WriteVal_OK",
        "key": "F@lv2_03_tlv_destmax_no_off.c:Tlv_WriteVal_OK",
        "at": "lv2_03_tlv_destmax_no_off.c:36",
        "end": "p3"
      },
      "path": ["Tlv_WriteVal_OK@lv2_03_tlv_destmax_no_off.c:36"],
      "depth": 0,
      "eff_depth": 0,
      "blind": false,
      "doc": {
        "text": "ulOff + ulValLen <= 128 ⇒ 读 ulValLen 字节 @ *pucVal，末端 ulValLen；需 ulValLen <= ext(pucVal)",
        "obj": "*pucVal",
        "bytes": "p3",
        "code": "memcpy_s(pucPkt + ulOff, PKT_MAX_LEN - ulOff, pucVal, ulValLen)",
        "note": "count <= destMax"
      }
    },
    {
      "id": "R3",
      "kind": "W",
      "have": "ext(p0)",
      "obj": "*p0",
      "end": ["4294967424", "4294967424"],
      "start": "p1",
      "bound": "exact",
      "guard": ["p1 >= 2147483777"],
      "access": {
        "fn": "Tlv_WriteVal_OK",
        "key": "F@lv2_03_tlv_destmax_no_off.c:Tlv_WriteVal_OK",
        "at": "lv2_03_tlv_destmax_no_off.c:36",
        "end": "4294967424"
      },
      "path": ["Tlv_WriteVal_OK@lv2_03_tlv_destmax_no_off.c:36"],
      "depth": 0,
      "eff_depth": 0,
      "blind": false,
      "doc": {
        "text": "ulOff >= 2147483777 ⇒ 写 2^32 + 128 - ulOff 字节 @ *pucPkt，末端 4294967424；需 4294967424 <= ext(pucPkt)",
        "obj": "*pucPkt",
        "bytes": "4294967424 - p1",
        "code": "memcpy_s(pucPkt + ulOff, PKT_MAX_LEN - ulOff, pucVal, ulValLen)",
        "note": "F-03 第二段（SPEC-0020）：128 − ulOff 回绕成 2^32 + 128 − ulOff，不超过 0x7fffffff，securec 照样写"
      }
    },
    {
      "id": "R4",
      "kind": "R",
      "have": "ext(p2)",
      "obj": "*p2",
      "end": ["p3", "p3"],
      "start": "0",
      "bound": "exact",
      "guard": ["p1 + p3 <= 4294967424", "p1 >= 2147483777"],
      "access": {
        "fn": "Tlv_WriteVal_OK",
        "key": "F@lv2_03_tlv_destmax_no_off.c:Tlv_WriteVal_OK",
        "at": "lv2_03_tlv_destmax_no_off.c:36",
        "end": "p3"
      },
      "path": ["Tlv_WriteVal_OK@lv2_03_tlv_destmax_no_off.c:36"],
      "depth": 0,
      "eff_depth": 0,
      "blind": false,
      "doc": {
        "text": "ulOff >= 2147483777 且 ulOff + ulValLen <= 4294967424 ⇒ 读 ulValLen 字节 @ *pucVal；需 ulValLen <= ext(pucVal)",
        "obj": "*pucVal",
        "bytes": "p3",
        "code": "memcpy_s(pucPkt + ulOff, PKT_MAX_LEN - ulOff, pucVal, ulValLen)",
        "note": "F-03 第二段的源：count <= destMax 才读；段守卫总挂上（SPEC-0020 §2.2）"
      }
    }
  ],
  "effs": [],
  "calls": [
    {
      "site": "lv2_03_tlv_destmax_no_off.c:36",
      "callee": "memcpy_s",
      "model": "access",
      "args": [
        {"obj": "*p0", "have": "ext(p0) - p1", "doc": "pucPkt + ulOff"},
        "128 - ulOff",
        {"obj": "*p2", "have": "ext(p2)", "doc": "pucVal"},
        "p3"
      ],
      "results": [{"gen": ["R1", "R2"]}],
      "doc": "访问类模型 memcpy_s → R1、R2"
    }
  ],
  "reps": [],
  "opens": []
}
