{
  "schema": "oobsum-summary/1",
  "fn": "Ue_BuildName",
  "key": "F@lv1_02_name_terminator.c:Ue_BuildName",
  "loc": "lv1_02_name_terminator.c:39",
  "params": [{"name": "pszName", "type": "CHAR*"}, {"name": "ulUeId", "type": "UINT32"}],
  "status": "analyzed",
  "reqs": [
    {
      "id": "R1",
      "kind": "W",
      "have": "ext(p0)",
      "obj": "*p0",
      "end": ["17", "17"],
      "start": "16",
      "bound": "exact",
      "guard": [],
      "access": {
        "fn": "Name_Terminate",
        "key": "F@lv1_02_name_terminator.c:Name_Terminate",
        "at": "lv1_02_name_terminator.c:29",
        "end": "17"
      },
      "path": [
        "Ue_BuildName@lv1_02_name_terminator.c:41",
        "Name_Format@lv1_02_name_terminator.c:36",
        "Name_Terminate@lv1_02_name_terminator.c:29"
      ],
      "depth": 2,
      "eff_depth": 0,
      "blind": false,
      "doc": {
        "text": "写 1 字节 @ *pszName，末端 17；需 17 <= ext(pszName)",
        "obj": "*pszName",
        "bytes": "1",
        "code": "pszName[UE_NAME_LEN] = '\\0'"
      }
    }
  ],
  "effs": [],
  "calls": [
    {
      "site": "lv1_02_name_terminator.c:41",
      "callee": "Name_Format",
      "args": [{"obj": "*p0", "have": "ext(p0)", "alias": "p0", "doc": "pszName"}, "p1"],
      "results": [{"req": "R1", "outcome": "up", "as": "R1"}]
    }
  ],
  "reps": [],
  "opens": []
}
