{
  "schema": "oobsum-summary/1",
  "fn": "Pkt_PutIes_OK",
  "key": "F@lv3_07_pkt_loop_destmax.c:Pkt_PutIes_OK",
  "loc": "lv3_07_pkt_loop_destmax.c:34",
  "params": [
    {"name": "pucPkt", "type": "UINT8*"},
    {"name": "ulPktLen", "type": "UINT32"},
    {"name": "astIe", "type": "IE_S*"},
    {"name": "ulIeNum", "type": "UINT32"}
  ],
  "status": "analyzed",
  "reqs": [
    {
      "id": "R1",
      "kind": "W",
      "have": "ext(p0)",
      "obj": "*p0",
      "end": ["p1", "p1"],
      "start": "0",
      "bound": "exact",
      "guard": [],
      "access": {
        "fn": "Pkt_PutIes_OK",
        "key": "F@lv3_07_pkt_loop_destmax.c:Pkt_PutIes_OK",
        "at": "lv3_07_pkt_loop_destmax.c:42",
        "end": "p1"
      },
      "path": ["Pkt_PutIes_OK@lv3_07_pkt_loop_destmax.c:42"],
      "depth": 0,
      "eff_depth": 0,
      "blind": false,
      "doc": {
        "text": "写 ulPktLen - ulOff 字节 @ *pucPkt，末端 ulPktLen；需 ulPktLen <= ext(pucPkt)",
        "obj": "*pucPkt",
        "bytes": "p1 - ulOff",
        "code": "memcpy_s(pucPkt + ulOff, ulPktLen - ulOff, astIe[i].pucVal, astIe[i].ulLen)",
        "note": "末端 ulOff + (ulPktLen − ulOff)：先抵消 ulOff 再代区间；校验 ulOff + len <= ulPktLen 保证减法不回绕"
      }
    }
  ],
  "effs": [],
  "calls": [
    {
      "site": "lv3_07_pkt_loop_destmax.c:42",
      "callee": "memcpy_s",
      "model": "access",
      "args": [{"obj": "*p0", "have": "ext(p0) - ulOff", "doc": "pucPkt + ulOff"}, "p1 - ulOff", null, null],
      "locals": {"ulOff": {"range": ["0", "p1"], "bound": "check"}},
      "results": [{"gen": ["R1"]}],
      "doc": "访问类模型 memcpy_s → R1；源 astIe[i].pucVal 记账"
    }
  ],
  "reps": [],
  "opens": [
    {
      "reason": "untracked_pointer",
      "at": "lv3_07_pkt_loop_destmax.c:42",
      "doc": "源指针 astIe[i].pucVal 来自数组元素的字段，P0 不跟踪它指向多大"
    }
  ]
}
