{
  "schema": "oobsum-summary/1",
  "fn": "Om_DumpReg_TP",
  "key": "F:Om_DumpReg_TP",
  "loc": "lv7_04_pointer_stepping.c:34",
  "params": [],
  "status": "analyzed",
  "reqs": [],
  "effs": [],
  "calls": [
    {
      "site": "lv7_04_pointer_stepping.c:38",
      "callee": "Om_CollectReg",
      "args": [
        {"obj": "local:aucOut", "have": "16", "doc": "aucOut"},
        {"obj": "local:aucIn", "have": "32", "doc": "aucIn"},
        "32"
      ],
      "results": [],
      "doc": "被调者没有条件 → 不报；漏报在 Buf_CopyStep 的账本里"
    }
  ],
  "reps": [],
  "opens": []
}
