{
  "schema": "oobsum-summary/1",
  "fn": "Om_CollectChip",
  "key": "F@lv9_04_external_driver.c:Om_CollectChip",
  "loc": "lv9_04_external_driver.c:26",
  "params": [{"name": "pucBuf", "type": "UINT8*"}, {"name": "ulLen", "type": "UINT32"}],
  "status": "analyzed",
  "reqs": [],
  "effs": [
    {
      "kind": "ret_int",
      "range": ["0", "4294967295"],
      "bound": "type",
      "doc": {"text": "ret ∈ [0, 4294967295]"}
    }
  ],
  "calls": [
    {
      "site": "lv9_04_external_driver.c:26",
      "callee": "Chip_ReadStatus",
      "args": [{"obj": "*p0", "have": "ext(p0)", "alias": "p0", "doc": "pucBuf"}, "p1"],
      "results": [],
      "doc": "被调者没有条件"
    }
  ],
  "reps": [],
  "opens": []
}
