{
  "schema": "oobsum-summary/1",
  "fn": "Cfg_Store",
  "key": "F@lv10_04_unchecked_ext_len.c:Cfg_Store",
  "loc": "lv10_04_unchecked_ext_len.c:39",
  "params": [{"name": "p", "type": "UINT8*"}, {"name": "n", "type": "UINT32"}],
  "status": "analyzed",
  "reqs": [
    {
      "id": "R1",
      "kind": "W",
      "have": "256",
      "obj": "g:g_aucCfg",
      "end": ["p1", "p1"],
      "start": "0",
      "bound": "exact",
      "guard": [],
      "access": {
        "fn": "Cfg_Save",
        "key": "F@lv10_04_unchecked_ext_len.c:Cfg_Save",
        "at": "lv10_04_unchecked_ext_len.c:36",
        "end": "p1"
      },
      "path": ["Cfg_Store@lv10_04_unchecked_ext_len.c:39", "Cfg_Save@lv10_04_unchecked_ext_len.c:36"],
      "depth": 1,
      "eff_depth": 0,
      "blind": false,
      "doc": {
        "text": "写 n 字节 @ g_aucCfg，末端 n；需 n <= 256",
        "obj": "g_aucCfg",
        "bytes": "p1",
        "code": "memcpy_s(g_aucCfg, ulLen, pucBody, ulLen)"
      }
    },
    {
      "id": "R2",
      "kind": "R",
      "have": "ext(p0)",
      "obj": "*p0",
      "end": ["p1", "p1"],
      "start": "0",
      "bound": "exact",
      "guard": [],
      "access": {
        "fn": "Cfg_Save",
        "key": "F@lv10_04_unchecked_ext_len.c:Cfg_Save",
        "at": "lv10_04_unchecked_ext_len.c:36",
        "end": "p1"
      },
      "path": ["Cfg_Store@lv10_04_unchecked_ext_len.c:39", "Cfg_Save@lv10_04_unchecked_ext_len.c:36"],
      "depth": 1,
      "eff_depth": 0,
      "blind": false,
      "doc": {
        "text": "读 n 字节 @ *p，末端 n；需 n <= ext(p)",
        "obj": "*p",
        "bytes": "p1",
        "code": "memcpy_s(g_aucCfg, ulLen, pucBody, ulLen)"
      }
    }
  ],
  "effs": [],
  "calls": [
    {
      "site": "lv10_04_unchecked_ext_len.c:39",
      "callee": "Cfg_Save",
      "args": [{"obj": "*p0", "have": "ext(p0)", "alias": "p0", "doc": "p"}, "p1"],
      "results": [{"req": "R1", "outcome": "up", "as": "R1"}, {"req": "R2", "outcome": "up", "as": "R2"}]
    }
  ],
  "reps": [],
  "opens": []
}
