{
  "schema": "oobsum-summary/1",
  "fn": "Enc_PutIe",
  "key": "F@lv5_01_ctx_filled_at_top.c:Enc_PutIe",
  "loc": "lv5_01_ctx_filled_at_top.c:40",
  "params": [
    {"name": "pstCtx", "type": "ENC_CTX_S*"},
    {"name": "pucIe", "type": "UINT8*"},
    {"name": "ulLen", "type": "UINT32"}
  ],
  "fields": {
    "p0->pucBuf": {"off": 0, "size": 4, "type": "UINT8*"},
    "p0->ulBufLen": {"off": 4, "size": 4, "type": "UINT32"},
    "p0->ulUsed": {"off": 8, "size": 4, "type": "UINT32"}
  },
  "status": "analyzed",
  "reqs": [
    {
      "id": "R1",
      "kind": "W",
      "have": "ext(p0->pucBuf)",
      "obj": "*p0->pucBuf",
      "end": ["p0->ulBufLen", "p0->ulBufLen"],
      "start": "0",
      "bound": "exact",
      "guard": [],
      "access": {
        "fn": "Enc_PutBytes",
        "key": "F@lv5_01_ctx_filled_at_top.c:Enc_PutBytes",
        "at": "lv5_01_ctx_filled_at_top.c:36",
        "end": "p0->ulBufLen"
      },
      "path": ["Enc_PutIe@lv5_01_ctx_filled_at_top.c:40", "Enc_PutBytes@lv5_01_ctx_filled_at_top.c:36"],
      "depth": 1,
      "eff_depth": 0,
      "blind": false,
      "doc": {
        "text": "写 pstCtx->ulBufLen 字节 @ *pstCtx->pucBuf，末端 pstCtx->ulBufLen；需 pstCtx->ulBufLen <= ext(pstCtx->pucBuf)",
        "obj": "*pstCtx->pucBuf",
        "bytes": "p0->ulBufLen",
        "code": "memcpy_s(pstCtx->pucBuf, pstCtx->ulBufLen, pucData, ulLen)"
      }
    },
    {
      "id": "R2",
      "kind": "R",
      "have": "ext(p1)",
      "obj": "*p1",
      "end": ["p2", "p2"],
      "start": "0",
      "bound": "exact",
      "guard": ["p2 <= p0->ulBufLen"],
      "access": {
        "fn": "Enc_PutBytes",
        "key": "F@lv5_01_ctx_filled_at_top.c:Enc_PutBytes",
        "at": "lv5_01_ctx_filled_at_top.c:36",
        "end": "p2"
      },
      "path": ["Enc_PutIe@lv5_01_ctx_filled_at_top.c:40", "Enc_PutBytes@lv5_01_ctx_filled_at_top.c:36"],
      "depth": 1,
      "eff_depth": 0,
      "blind": false,
      "doc": {
        "text": "ulLen <= pstCtx->ulBufLen ⇒ 读 ulLen 字节 @ *pucIe，末端 ulLen；需 ulLen <= ext(pucIe)",
        "obj": "*pucIe",
        "bytes": "p2",
        "code": "memcpy_s(pstCtx->pucBuf, pstCtx->ulBufLen, pucData, ulLen)"
      }
    }
  ],
  "effs": [{"kind": "field", "target": "p0->ulUsed", "value": "p2", "doc": {"text": "pstCtx->ulUsed := ulLen"}}],
  "calls": [
    {
      "site": "lv5_01_ctx_filled_at_top.c:40",
      "callee": "Enc_PutBytes",
      "args": [
        {"obj": "*p0", "have": "ext(p0)", "alias": "p0", "doc": "pstCtx"},
        {"obj": "*p1", "have": "ext(p1)", "alias": "p1", "doc": "pucIe"},
        "p2"
      ],
      "results": [
        {"req": "R1", "outcome": "up", "as": "R1"},
        {"req": "R2", "outcome": "up", "as": "R2"},
        {"eff": 0, "apply": {"kind": "field", "arg": 0, "field": "ulUsed", "value": "p2"}}
      ]
    }
  ],
  "reps": [],
  "opens": []
}
