{
  "schema": "oobsum-summary/1",
  "fn": "Msg_BuildBody_OK",
  "key": "F@lv3_07_pkt_loop_destmax.c:Msg_BuildBody_OK",
  "loc": "lv3_07_pkt_loop_destmax.c:69",
  "params": [
    {"name": "p", "type": "UINT8*"},
    {"name": "n", "type": "UINT32"},
    {"name": "a", "type": "IE_S*"},
    {"name": "k", "type": "UINT32"}
  ],
  "status": "analyzed",
  "reqs": [
    {
      "id": "R1",
      "kind": "W",
      "have": "ext(p0)",
      "obj": "*p0",
      "end": ["p1", "p1"],
      "start": "0",
      "bound": "exact",
      "guard": [],
      "access": {
        "fn": "Pkt_PutIes_OK",
        "key": "F@lv3_07_pkt_loop_destmax.c:Pkt_PutIes_OK",
        "at": "lv3_07_pkt_loop_destmax.c:42",
        "end": "p1"
      },
      "path": [
        "Msg_BuildBody_OK@lv3_07_pkt_loop_destmax.c:69",
        "Body_PutIes_OK@lv3_07_pkt_loop_destmax.c:67",
        "Pkt_PutIes_OK@lv3_07_pkt_loop_destmax.c:42"
      ],
      "depth": 2,
      "eff_depth": 0,
      "blind": false,
      "doc": {
        "text": "写 n - ulOff 字节 @ *p，末端 n；需 n <= ext(p)",
        "obj": "*p",
        "bytes": "p1 - ulOff",
        "code": "memcpy_s(pucPkt + ulOff, ulPktLen - ulOff, astIe[i].pucVal, astIe[i].ulLen)"
      }
    },
    {
      "id": "R2",
      "kind": "R",
      "have": "ext(p2)",
      "obj": "*p2",
      "end": ["8", "8*p3"],
      "start": "4",
      "bound": "loop",
      "guard": ["p3 >= 1"],
      "access": {
        "fn": "Pkt_PutIes_OK",
        "key": "F@lv3_07_pkt_loop_destmax.c:Pkt_PutIes_OK",
        "at": "lv3_07_pkt_loop_destmax.c:39",
        "end": "8*p3"
      },
      "path": [
        "Msg_BuildBody_OK@lv3_07_pkt_loop_destmax.c:69",
        "Body_PutIes_OK@lv3_07_pkt_loop_destmax.c:67",
        "Pkt_PutIes_OK@lv3_07_pkt_loop_destmax.c:39"
      ],
      "depth": 2,
      "eff_depth": 0,
      "blind": false
    }
  ],
  "effs": [],
  "calls": [
    {
      "site": "lv3_07_pkt_loop_destmax.c:69",
      "callee": "Body_PutIes_OK",
      "args": [
        {"obj": "*p0", "have": "ext(p0)", "alias": "p0", "doc": "p"},
        "p1",
        {"obj": "*p2", "have": "ext(p2)", "alias": "p2", "doc": "a"},
        "p3"
      ],
      "results": [{"req": "R1", "outcome": "up", "as": "R1"}, {"req": "R2", "outcome": "up", "as": "R2"}]
    }
  ],
  "reps": [],
  "opens": []
}
