{
  "schema": "oobsum-summary/1",
  "fn": "Rrc_EncodeMsg_TP",
  "key": "F:Rrc_EncodeMsg_TP",
  "loc": "lv5_01_ctx_filled_at_top.c:43",
  "params": [],
  "status": "analyzed",
  "reqs": [],
  "effs": [],
  "calls": [
    {
      "site": "lv5_01_ctx_filled_at_top.c:51",
      "callee": "Enc_Encode",
      "args": [
        {
          "obj": "local:stCtx",
          "have": "12",
          "fields": {"pucBuf": {"obj": "local:aucBuf", "have": "128", "doc": "aucBuf"}, "ulBufLen": "256"},
          "doc": "&stCtx"
        },
        {"obj": "local:aucIe", "have": "16", "doc": "aucIe"},
        "16"
      ],
      "results": [
        {"req": "R1", "outcome": "L1", "report": "RPT1"},
        {"req": "R2", "outcome": "safe"},
        {"eff": 0, "apply": {"kind": "field", "arg": 0, "field": "ulUsed", "value": "16"}}
      ],
      "doc": "帧内字段：stCtx.pucBuf = aucBuf（128 字节），stCtx.ulBufLen = ENC_BUF_LEN = 256"
    }
  ],
  "reps": [
    {
      "id": "RPT1",
      "level": "L1",
      "reported": true,
      "site": "lv5_01_ctx_filled_at_top.c:51",
      "access": {
        "fn": "Enc_PutBytes",
        "key": "F@lv5_01_ctx_filled_at_top.c:Enc_PutBytes",
        "at": "lv5_01_ctx_filled_at_top.c:36",
        "end": "p0->ulBufLen"
      },
      "kind": "W",
      "obj": "local:aucBuf",
      "via": "local:stCtx.pucBuf",
      "have": "128",
      "end": ["256", "256"],
      "bound": "exact",
      "depth": 3,
      "eff_depth": 0,
      "chain": [
        "Rrc_EncodeMsg_TP@lv5_01_ctx_filled_at_top.c:51",
        "Enc_Encode@lv5_01_ctx_filled_at_top.c:41",
        "Enc_PutIe@lv5_01_ctx_filled_at_top.c:40",
        "Enc_PutBytes@lv5_01_ctx_filled_at_top.c:36"
      ],
      "fp": "dfa3e964ffe3b219",
      "doc": {
        "msg": "Definite out-of-bound write through a 3-level call chain: up to byte 256 of 'aucBuf' (128 bytes; via stCtx.pucBuf) is accessed"
      }
    }
  ],
  "opens": []
}
